{
  "schema": 1,
  "round": 1,
  "head": "245019069d0a997657125c6ec9eab73eec7ce69a",
  "answers": [
    {
      "file": "python/tests/test_pager.py",
      "line": null,
      "rule": ".nunnarivu/skills/test/SKILL.md step 2: \"For every acceptance criterion write a test\"",
      "outcome": "fixed",
      "note": "Added test_cli_rejects_size_below_one beside the existing CLI test: it runs python -m pager --size 0 with two lines of input and asserts exit code 0, empty stdout and the '--size must be a positive integer' message on stderr, guarding the unchanged CLI behaviour named in package.md. make check and make test pass (7 Python tests)."
    }
  ]
}
